match_id,match_title,event,date,format,teams,score,maps_played,patch,pick_ban_info
430838,TYLOO vs Titan Esports Club,VCT 2025: China Kickoff,2025-01-11 04:00:00,Bo3,TYLOO vs Titan Esports Club,0 - 2,2,,TEC ban Split; TYL ban Lotus; TEC pick Fracture; TYL pick Abyss; TEC ban Bind; TYL ban Haven; Pearl remains
430837,Xi Lai Gaming vs Wolves Esports,VCT 2025: China Kickoff,2025-01-11 06:35:00,Bo3,Xi Lai Gaming vs Wolves Esports,2 - 0,2,,XLG ban Fracture; WOL ban Bind; XLG pick Lotus; WOL pick Split; XLG ban Pearl; WOL ban Haven; Abyss remains
430839,JD Mall JDG Esports(JDG Esports) vs Dragon Ranger Gaming,VCT 2025: China Kickoff,2025-01-12 04:00:00,Bo3,JD Mall JDG Esports(JDG Esports) vs Dragon Ranger Gaming,1 - 2,3,,JDG ban Lotus; DRG ban Fracture; JDG pick Abyss; DRG pick Haven; JDG ban Split; DRG ban Pearl; Bind remains
430840,All Gamers vs Nova Esports,VCT 2025: China Kickoff,2025-01-12 07:25:00,Bo3,All Gamers vs Nova Esports,0 - 2,2,,NOVA ban Haven; AG ban Fracture; NOVA pick Abyss; AG pick Bind; NOVA ban Lotus; AG ban Pearl; Split remains
430842,FunPlus Phoenix vs Titan Esports Club,VCT 2025: China Kickoff,2025-01-16 04:00:00,Bo3,FunPlus Phoenix vs Titan Esports Club,2 - 1,3,,TEC ban Lotus; FPX ban Split; TEC pick Abyss; FPX pick Fracture; TEC ban Haven; FPX ban Bind; Pearl remains
430841,Bilibili Gaming vs Xi Lai Gaming,VCT 2025: China Kickoff,2025-01-16 07:20:00,Bo3,Bilibili Gaming vs Xi Lai Gaming,2 - 1,3,,XLG ban Fracture; BLG ban Bind; XLG pick Haven; BLG pick Lotus; XLG ban Pearl; BLG ban Split; Abyss remains
430843,Trace Esports vs Dragon Ranger Gaming,VCT 2025: China Kickoff,2025-01-17 04:00:00,Bo3,Trace Esports vs Dragon Ranger Gaming,2 - 0,2,,TE ban Haven; DRG ban Fracture; TE pick Pearl; DRG pick Abyss; TE ban Split; DRG ban Lotus; Bind remains
430844,EDward Gaming vs Nova Esports,VCT 2025: China Kickoff,2025-01-17 06:10:00,Bo3,EDward Gaming vs Nova Esports,2 - 0,2,,NOVA ban Haven; EDG ban Abyss; NOVA pick Split; EDG pick Fracture; NOVA ban Pearl; EDG ban Lotus; Bind remains
430851,Titan Esports Club vs JD Mall JDG Esports(JDG Esports),VCT 2025: China Kickoff,2025-01-18 04:00:00,Bo3,Titan Esports Club vs JD Mall JDG Esports(JDG Esports),0 - 2,2,,JDG ban Lotus; TEC ban Split; JDG pick Fracture; TEC pick Abyss; JDG ban Bind; TEC ban Haven; Pearl remains
430853,Xi Lai Gaming vs All Gamers,VCT 2025: China Kickoff,2025-01-18 06:20:00,Bo3,Xi Lai Gaming vs All Gamers,2 - 1,3,,AG ban Haven; XLG ban Fracture; AG pick Abyss; XLG pick Bind; AG ban Pearl; XLG ban Split; Lotus remains
430850,Dragon Ranger Gaming vs TYLOO,VCT 2025: China Kickoff,2025-01-19 04:00:00,Bo3,Dragon Ranger Gaming vs TYLOO,2 - 0,2,,TYL ban Lotus; DRG ban Fracture; TYL pick Pearl; DRG pick Haven; TYL ban Split; DRG ban Bind; Abyss remains
430849,Nova Esports vs Wolves Esports,VCT 2025: China Kickoff,2025-01-19 06:15:00,Bo3,Nova Esports vs Wolves Esports,2 - 1,3,,WOL ban Bind; NOVA ban Haven; WOL pick Fracture; NOVA pick Abyss; WOL ban Lotus; NOVA ban Pearl; Split remains
430845,Bilibili Gaming vs FunPlus Phoenix,VCT 2025: China Kickoff,2025-01-20 04:00:00,Bo3,Bilibili Gaming vs FunPlus Phoenix,2 - 0,2,,BLG ban Fracture; FPX ban Split; BLG pick Bind; FPX pick Lotus; BLG ban Pearl; FPX ban Haven; Abyss remains
430846,Trace Esports vs EDward Gaming,VCT 2025: China Kickoff,2025-01-20 06:25:00,Bo3,Trace Esports vs EDward Gaming,2 - 0,2,,TE ban Haven; EDG ban Abyss; TE pick Lotus; EDG pick Bind; TE ban Split; EDG ban Pearl; Fracture remains
430854,Nova Esports vs Dragon Ranger Gaming,VCT 2025: China Kickoff,2025-01-21 04:00:00,Bo3,Nova Esports vs Dragon Ranger Gaming,0 - 2,2,,DRG ban Fracture; NOVA ban Haven; DRG pick Pearl; NOVA pick Bind; DRG ban Split; NOVA ban Lotus; Abyss remains
430855,JD Mall JDG Esports(JDG Esports) vs Xi Lai Gaming,VCT 2025: China Kickoff,2025-01-21 06:15:00,Bo3,JD Mall JDG Esports(JDG Esports) vs Xi Lai Gaming,1 - 2,3,,JDG ban Lotus; XLG ban Fracture; JDG pick Pearl; XLG pick Bind; JDG ban Split; XLG ban Abyss; Haven remains
430856,FunPlus Phoenix vs Dragon Ranger Gaming,VCT 2025: China Kickoff,2025-01-22 04:00:00,Bo3,FunPlus Phoenix vs Dragon Ranger Gaming,1 - 2,3,,DRG ban Fracture; FPX ban Split; DRG pick Abyss; FPX pick Pearl; DRG ban Lotus; FPX ban Bind; Haven remains
430857,EDward Gaming vs Xi Lai Gaming,VCT 2025: China Kickoff,2025-01-22 07:05:00,Bo3,EDward Gaming vs Xi Lai Gaming,2 - 1,3,,EDG ban Abyss; XLG ban Fracture; EDG pick Lotus; XLG pick Bind; EDG ban Split; XLG ban Pearl; Haven remains
430847,Bilibili Gaming vs Trace Esports,VCT 2025: China Kickoff,2025-01-23 04:00:00,Bo3,Bilibili Gaming vs Trace Esports,1 - 2,3,,TE ban Abyss; BLG ban Fracture; TE pick Bind; BLG pick Haven; TE ban Pearl; BLG ban Split; Lotus remains
430858,Dragon Ranger Gaming vs EDward Gaming,VCT 2025: China Kickoff,2025-01-23 07:15:00,Bo3,Dragon Ranger Gaming vs EDward Gaming,0 - 2,2,,DRG ban Fracture; EDG ban Abyss; DRG pick Haven; EDG pick Pearl; DRG ban Bind; EDG ban Split; Lotus remains
430860,Bilibili Gaming vs EDward Gaming,VCT 2025: China Kickoff,2025-01-24 04:00:00,Bo5,Bilibili Gaming vs EDward Gaming,0 - 3,3,,BLG ban Fracture; EDG ban Abyss; BLG pick Pearl; EDG pick Haven; BLG pick Lotus; EDG pick Bind; Split remains
430848,Trace Esports vs EDward Gaming,VCT 2025: China Kickoff,2025-01-25 04:00:00,Bo5,Trace Esports vs EDward Gaming,1 - 3,4,,TE ban Haven; TE ban Split; TE pick Lotus; EDG pick Bind; TE pick Abyss; EDG pick Fracture; Pearl remains
